Company Name,Title,Job Location,Job Description
"

Federal Reserve Bank of Dallas",Data Scientist/IT Auditor,"Dallas, TX 75201","Data Scientist/IT Auditor-261879
Federal Reserve Bank of Dallas
Primary Location TX-Dallas
Full-time / Part-time Full-time
Employee Status Regular
Overtime Status Exempt
Job Type Experienced
Travel Yes, 5 % of the Time
Shift Day Job
Job Sensitivity Tier II - No Credit Check
About the Role

We are looking for an action-oriented Data Scientist/Auditor to provide the department with support in analyzing and presenting data using statistical analysis and data visualization techniques and best practices. The Data Scientist/Auditor is responsible for conducting and documenting assigned information technology audit projects, preparing well-documented work papers, and effectively communicating audit findings and recommendations. This individual will work in partnership with other team members and Bank employees to interpret qualitative and quantitative data in order to identify solutions to Bank-wide issues and problems.

You Will
Work collaboratively with Audit Management and staff to execute the annual audit plan
Seek to understand and define problems and concerns within the Bank that require the collection and analysis of data to support robust decision making
Provide recommendations on how to collect data, analyze the data and present recommendations to others based on their interpretation of the analyses
Ensure work is documented in accordance with the Institute of Internal Auditors International Standards for the Professional Practice of Internal Auditing and departmental procedures
Effectively document and communicate audit results to Audit department and Bank management
Serve as auditor-in-charge for low to moderate complexity audits under direct supervision of Audit department management, as appropriate
Perform follow-up on reported observations and document results.
Assist in the specification and design of electronic data collection, reporting and processing tools, including SharePoint, and other end user technologies with a focus on providing or processing analytical, status reporting and decision support information
Participate on department, district or system workgroups, projects, and initiatives, as well as System audit competency centers and knowledge forums, as appropriate
Serve as audit liaison for business areas of low to moderate complexity
You Will Bring
Bachelor’s degree in Business, Economics, Mathematics, Computer Science, Management Information Systems, Statistics or other business related field of study
Academic or professional experience in statistical analyses and the use of common statistical software tools, such as Tableau, SAS, SPSS and R
Strong critical thinking skills and the ability to communicate (verbally and in writing) effectively to a variety of audiences
Ability to work collaboratively across a variety of business units within the organization
Equivalent education and/or experience which may be substituted for any of the above requirements
The Team

You will work with 18 other team members, 17 that work in Dallas and 1 that works in our Houston office, all of them working towards being recognized as internal control and business process knowledge leaders who assurance and consulting services add value and identify opportunities for management to improve the Eleventh District’s and Federal Reserve System’s operations.

Our Benefits

You can select benefit plans that are the best fit for you at every stage of your career:
Health, dental and vision coverage that is tops in the nation and low-cost
Savings Thrift (401K) Plan with a 100% match up to 6%, including a pension plan
Free credit protection, financial planning, and flexible spending accounts or health savings accounts
Paid vacation and 11 paid Bank holidays; flexible work environment, healthy workflow
Opportunities to participate in employee resource groups to learn more about your colleagues, hone your leadership skills and contribute to causes you are passionate about
Healthy lifestyle assistance through an on-site fitness center, subsidized cafeteria with healthy food options, and a state-of-the-art working environment
Generously subsidized public transportation and free on-site underground parking
Annual tuition reimbursement: $15,000 graduate degree, $7,500 undergraduate degree
Barbeque Thursdays and so much more!
Why the Fed?

The Federal Reserve Bank of Dallas is dedicated to serving the public by partnering with communities and businesses, promoting jobs and stable prices, and keeping your money safe and available. We have opportunities aside from Finance and Banking Supervision and regulation that range from electricians to law enforcement, and many more. We welcome differing perspectives and are committed to maintaining an inclusive and diverse culture.

Notes:

This position may be filled at various levels based on candidate's qualifications as determined by the department.

Employment is contingent upon the selected candidate passing a criminal background check.

Are you ready to make a difference?

The Federal Reserve Bank of Dallas is proud to be an Equal Opportunity Employer that believes in the diversity of our people, ideas and experiences, and we are committed to building an inclusive culture that represents the communities we serve.

If you need special or additional accommodations during your interview process, please notify your Talent Acquisition Consultant.
."
"

JCPenney",Data Scientist - Site Search Relevancy,"Plano, TX","Location: Plano, TX, United States -

Job ID: 1087080
Corporate Positions
Technology
Job Type: Full-Time
Date Updated: Dec 20, 2019
Data Scientist - Site Search Relevancy - Ecommerce Product Group
We are looking for an experienced Data Scientist to join our Search and Findability team focused on utilizing advanced machine learning techniques to drive product discovery to new heights in their KPI performance. Our environment consists of a modern e-commerce stack where we utilize advanced technologies like machine learning and relevancy ranking. You will have a direct impact on the Search and Browse paths for millions of customers and drive conversions for millions of products on the way. As a successful Data Scientist on the Product team, you will be utilizing advanced data models and also work with an interdisciplinary team (Relevancy Engineers, UX Experts) while utilizing state-of-the-art tools (Snowflake, SOLR)
Primary Responsibilities:
Apply machine learning and data science models to optimize product rankings and sorting options.
Improve product discovery by improving Search Product and Relevancy Ranking algorithms
Collaborate with Relevancy Engineers and Data Science group – recommend new models/ model improvements
Extend/augment company data with third party data, enhance data collection procedures to include information required to build analytic systems
Assist with designing and building infrastructure to facilitate analytics and experimentation
Present results and make recommendations in a clear manner to senior leadership
Provide thought leadership and mentor data science community across the organization
Contribute in Scrum meetings and process (Agile environment)
Core Competencies & Accomplishments:
MS in Statistics, Computer Science, Applied Math, or a related quantitative field + 5-7 years’ experience in machine learning, data mining, or Relevancy Ranking
Excellent understanding of various machine learning techniques and their applications
Experience in data management, statistical analysis, and machine learning (e.g. Python, R, Spark, H20)
Strongly prefer experience in retail ecommerce or related domain
Strong customer service and communication skills, ability to interact with diverse team of people across business and engineering
What you get:
Our corporate office, located within the exciting new development of Legacy West in Plano, Texas, supports JCPenney stores and supply chain facilities nationwide. We offer a competitive benefits package including medical/dental/vision, term life insurance, paid vacation/holidays, 401(k) Savings Plan with company match, and an associate discount on JCPenney merchandise. On-site campus amenities include health clinic, pharmacy, daycare and preschool, full cafeteria service, a 24-hour fitness center and free garage parking.
About JCPenney:
At JCPenney, we share a passion for serving customers, supporting our communities and being the best retailer for all families. As a company founded on the Golden Rule, our success is rooted in the belief that we treat everyone the way we would want to be treated. At every touchpoint, customers discover stylish merchandise at incredible value from an extensive portfolio of private, exclusive and national brands. Reinforcing this shopping experience is the customer service and warrior spirit of approximately 98,000 associates across the globe, all driving toward the Company's mission to help customers find what they love for less time, money and effort.
Working at JCPenney means joining a dedicated team of associates who are encouraged to be uniquely themselves in a safe, caring and welcoming environment. It is a place where careers prosper, accomplishments are celebrated and diversity flourishes. It’s a place that’s meant for you.
For more opportunities to join our team please visit our careers page.
Follow us and see what’s new: Instagram Facebook Twitter LinkedIn Pinterest Media Room jcp.com
#LI-RP1"
